{"allowed_tools":[{"step_id":"step:01-read-feature-001","tool":"rq2.feature.read/1.0"},{"step_id":"step:02-validate-source-authority-001","tool":"rq2.source-authority.validate/1.0"},{"step_id":"step:03-validate-geometry-type-001","tool":"rq2.geometry.validate/1.0"},{"step_id":"step:04-derive-target-representation-001","tool":"rq2.representation.derive/1.0"},{"step_id":"step:05-write-derived-artifact-001","tool":"rq2.artifact.write-derived/1.0"},{"step_id":"step:06-verify-postconditions-001","tool":"rq2.postconditions.verify/1.0"}],"authorization_hash":"e74a36cd08d73c5188e59ed93f77b2c0651f002a7d7b98a5eccc47d47828f63d","authorization_id":"rq3-authorization:canonical-positive-001","authorized_scope":{"authoritative_render":false,"bounded_unresolved_constraint_ids":["constraint:guard.color-code-7-profile","constraint:guard.internal-glyph-trace","constraint:guard.line-code-2-metric","constraint:relationship.product_layer"],"datasets":[{"id":"data/rq2/rq2-demo-01-fire-hydrant.geojson","sha256":"6888bb077c6f7de2183ca1d4b1ca7d4bee934f939be7235520243c6cb4d10611"}],"feature_ids":["hydrant-research-001"],"layer_ids":["rq2-demo-01-fire-hydrant"],"maximum_execution_count":2,"mutation_type":"ISOLATED_DERIVED_ARTIFACT_WRITE","operation_types":["read_feature","validate_source_authority","validate_geometry_type","derive_target_representation","write_derived_artifact","verify_postconditions"],"output_destinations":["artifacts/rq3/runtime/{execution_id}/derived-feature.geojson"],"replay_policy":"ONE_EXACT_IDEMPOTENT_REPLAY","source_access":"READ_ONLY"},"authorized_subject":{"agent_id":"rq3-deterministic-executor/1.0","operator_id":"rq3-research-operator:fixture-001","workflow_id":"rq3-demo-01-canonical-workflow"},"canonicalization":"nma-canonical-json-sort-keys-utf8-sha256;exclude=authorization_hash","decision":"APPROVED","issued_at":"2026-08-28T06:30:00Z","issuer":{"authority_semantics":"bounded-research-authorization-not-production-identity","issuer_id":"rq3-research-operator:fixture-001","issuer_type":"DETERMINISTIC_RESEARCH_FIXTURE"},"parameter_bounds":{"mode":"EXACT_PROPOSAL_VALUES","parameter_overrides_allowed":false,"proposal_plan_identity":"2bff5483934eb90a3bce3cdb9ab45e800b7f4c2deffca82e8a07fc31bec40e30"},"policy_reference":{"id":"data/specifications/rq3-trust-policy-v1.0.json","sha256":"81eda95af73bc16f3058b9e73fb2736941a3071271f1a7631fc3bb9d3e199631"},"proposal_hash":"116637146f3e515a8bbfb53ff0904934024acac0acdcd1ae3064af6d3bbf1eb1","proposal_id":"rq2-proposal:knowledge-constrained:e635111c3be29423faf923b7","schema_version":"rq3-authorization/1.0","valid_until":"2026-08-29T06:30:00Z"}
